,Unnamed: 0,id,title,author,authoryearofbirth,authoryearofdeath,language,downloads,subjects,type,publicationyear,age,agecategory,timecategory
13352,18469,PG26624,The Road to Oz,"Baum, L. Frank (Lyman Frank)",1856,1919,['en'],123,"{'Uncles -- Juvenile fiction', 'Kings and rulers -- Juvenile fiction', 'Oz (Imaginary place) -- Juvenile fiction', 'Princess Ozma (Fictitious character) -- Juvenile fiction', 'Good and evil -- Juvenile fiction', 'Voyages and travels -- Juvenile fiction', 'Gale, Dorothy (Fictitious character) -- Juvenile fiction', 'Animals, Mythical -- Juvenile fiction', 'Farms -- Juvenile fiction', 'Magic -- Juvenile fiction', 'Fantasy literature'}",Text,1909,53,3,10
16325,22531,PG3027,The Orange Fairy Book,"Lang, Andrew",1844,1912,['en'],123,"{'Folklore', 'Fairy tales'}",Text,1913,69,4,
14955,20675,PG2860,Framley Parsonage,"Trollope, Anthony",1815,1882,['en'],123,"{'Barsetshire (England: Imaginary place) -- Fiction', 'Clergy -- Fiction', 'Domestic fiction'}",Text,1861,46,2,8
1749,2701,PG12431,"The Coquette, or, The History of Eliza Wharton: A Novel: Founded on Fact","Foster, Hannah Webster",1759,1840,['en'],123,"{'Whitman, Elizabeth, 1752-1788 -- Fiction'}",Text,1828,69,4,4
6411,8886,PG179,The Europeans,"James, Henry",1843,1916,['en'],124,"{'Europeans -- United States -- Fiction', 'Boston (Mass.) -- Fiction', 'Domestic fiction', 'Brothers and sisters -- Fiction', 'Humorous stories', 'Upper class -- Fiction'}",Text,1878,35,2,9
17985,24702,PG32233,The Wind Among the Reeds,"Yeats, W. B. (William Butler)",1865,1939,['en'],125,{'Poetry'},Text,1908,43,2,10
6984,9598,PG18640,Phineas Redux,"Trollope, Anthony",1815,1882,['en'],126,"{'Widowers -- Fiction', 'Suspense fiction', 'Legislators -- Fiction', 'Legislators -- Crimes against -- Fiction', 'London (England) -- Fiction', 'Dublin (Ireland) -- Fiction', 'Palliser, Plantagenet (Fictitious character) -- Fiction', 'Psychological fiction', 'Political fiction'}",Text,1873,58,3,9
844,1301,PG11171,"Uncle Tom's Cabin, Young Folks' Edition","Stowe, Harriet Beecher",1811,1896,['en'],126,"{'Southern States -- Fiction', 'Fugitive slaves -- Fiction', 'Slavery -- Fiction', 'Slaves -- Fiction', 'African Americans -- Fiction', 'Political fiction', 'Master and servant -- Fiction', 'Plantation life -- Fiction', 'Uncle Tom (Fictitious character) -- Fiction', 'Didactic fiction'}",Text,1855,44,2,7
3649,5293,PG14765,El Gaucho Martín Fierro,"Hernández, José",1834,1886,['es'],126,{'Gauchos -- Poetry'},Text,1879,45,2,9
21433,29179,PG36264,A Harmony of the Gospels for Students of the Life of Christ: Based on the Broadus Harmony in the Revised Version,"Robertson, A. T.",1863,1934,['en'],127,{'Bible. Gospels -- Harmonies'},Text,1875,12,-1,9
6214,8642,PG17780,Scenes of Clerical Life,"Eliot, George",1819,1880,['en'],127,"{'England -- Social life and customs -- 19th century -- Fiction', 'Clergy -- Fiction'}",Text,1858,39,2,7
7876,10794,PG19717,"The Bostonians, Vol. I (of II)","James, Henry",1843,1916,['en'],128,"{'Boston (Mass.) -- Fiction', 'Feminists -- Fiction', 'Young women -- Fiction', 'Triangles (Interpersonal relations) -- Fiction', 'New York (N.Y.) -- Fiction', 'Psychological fiction'}",Text,1886,43,2,10
3897,5640,PG15077,The Tale of Mr. Jeremy Fisher,"Potter, Beatrix",1866,1943,['en'],130,{'Frogs -- Juvenile fiction'},Text,1906,40,2,10
698,1092,PG10984,Growth of the Soil,"Hamsun, Knut",1859,1952,['en'],131,{'Norway -- Fiction'},Text,1917,58,3,
21196,28878,PG35993,The History of Don Quixote de la Mancha,"Cervantes Saavedra, Miguel de",1547,1616,['en'],131,"{'Knights and knighthood -- Spain -- Fiction', 'Picaresque literature', 'Spain -- Social life and customs -- 16th century -- Fiction', 'Romances'}",Text,1885,338,4,10
4216,6068,PG15462,Alcools,"Apollinaire, Guillaume",1880,1918,['fr'],131,{'Poetry'},Text,1913,33,1,
87,132,PG10119,Adonais,"Shelley, Percy Bysshe",1792,1822,['en'],133,"{'Keats, John, 1795-1821 -- Poetry', 'Shelley, Percy Bysshe, 1792-1822 -- Criticism and interpretation'}",Text,1821,29,1,4
2782,4134,PG13721,"Mardi: and A Voyage Thither, Vol. II","Melville, Herman",1819,1891,['en'],133,"{'Polynesia -- Description and travel -- Fiction', 'Adventure stories'}",Text,1866,47,2,8
6825,9382,PG18446,Scènes de la vie de Bohème,"Murger, Henri",1822,1861,['fr'],134,"{'Paris (France) -- Intellectual life -- 19th century -- Fiction', 'Intellectuals -- France -- Paris -- Fiction'}",Text,1840,18,0,5
5633,7926,PG17135,Twas the Night before Christmas: A Visit from St. Nicholas,"Moore, Clement Clarke",1779,1863,['en'],134,"{'Narrative poetry', 'Santa Claus -- Juvenile poetry', ""Children's poetry, American"", 'Christmas -- Juvenile poetry'}",Text,1837,58,3,5
15911,21977,PG29782,"Space, Time and Gravitation: An Outline of the General Relativity Theory","Eddington, Arthur Stanley, Sir",1882,1944,['en'],135,"{'Space and time', 'Gravitation', 'Relativity (Physics)'}",Text,1915,33,1,
12538,17291,PG25564,The Water-Babies: A Fairy Tale for a Land-Baby,"Kingsley, Charles",1819,1875,['en'],136,"{'Chimney sweeps -- Juvenile fiction', 'Fairy tales -- England'}",Text,1863,44,2,8
3246,4762,PG14287,L'île mystérieuse,"Verne, Jules",1828,1905,['fr'],137,"{'Science fiction', 'Islands of the Pacific -- Fiction', 'Adventure stories', 'Castaways -- Fiction'}",Text,1882,54,3,10
16474,22731,PG3045,The Last Chronicle of Barset,"Trollope, Anthony",1815,1882,['en'],138,"{'England -- Social life and customs -- 19th century -- Fiction', 'Domestic fiction', 'Love stories', 'Barsetshire (England: Imaginary place) -- Fiction', 'Clergy -- Fiction', 'Psychological fiction', 'Clergy -- England -- Fiction'}",Text,1867,52,3,8
11412,15775,PG2419,La dame aux camélias,"Dumas, Alexandre",1824,1895,['fr'],138,"{'Courtesans -- Fiction', 'Love stories', 'Paris (France) -- Fiction', 'Tuberculosis -- Patients -- Fiction', 'Fathers and sons -- Fiction'}",Text,1853,29,1,7
12882,17758,PG25985,Bardell v. Pickwick,"Fitzgerald, Percy Hetherington",1834,1925,['en'],140,"{'Legal stories', 'Trials (Breach of promise) -- Fiction', 'Humorous stories', 'London (England) -- Fiction'}",Text,1836,2,-1,5
20061,27419,PG3467,The Life of Cesare Borgia,"Sabatini, Rafael",1875,1950,['en'],140,"{'Renaissance -- Italy', 'Borgia, Cesare, 1476?-1507'}",Text,1892,17,-1,10
11284,15598,PG2403,Die Wahlverwandtschaften,"Goethe, Johann Wolfgang von",1749,1832,['de'],141,"{'German fiction -- 19th century', 'Social problems -- Fiction', 'Adultery -- Fiction', 'Love stories, German', 'Aristocracy (Social class) -- Fiction'}",Text,1809,60,3,2
16904,23286,PG3095,The Lady of the Shroud,"Stoker, Bram",1847,1912,['en'],142,"{'Horror tales', 'Imaginary places -- Europe, Eastern -- Fiction'}",Text,1909,62,3,10
5602,7886,PG1709,New Grub Street,"Gissing, George",1857,1903,['en'],142,"{'London (England) -- Fiction', 'Authors -- Fiction', 'Journalists -- Fiction', 'Man-woman relationships -- Fiction', 'Psychological fiction', 'Authors and publishers -- Fiction'}",Text,1901,44,2,10
18928,25955,PG33361,"Ozma of Oz: A Record of Her Adventures with Dorothy Gale of Kansas, the Yellow Hen, the Scarecrow, the Tin Woodman, Tiktok, the Cowardly Lion, and the Hungry Tiger; Besides Other Good People too Numerous to Mention Faithfully Recorded Herein","Baum, L. Frank (Lyman Frank)",1856,1919,['en'],144,"{'Uncles -- Juvenile fiction', 'Scarecrow (Fictitious character from Baum) -- Juvenile fiction', 'Kings and rulers -- Juvenile fiction', 'Oz (Imaginary place) -- Juvenile fiction', 'Physicians -- Juvenile fiction', 'Tin Woodman (Fictitious character) -- Juvenile fiction', 'Princess Ozma (Fictitious character) -- Juvenile fiction', 'Gale, Dorothy (Fictitious character) -- Juvenile fiction', 'Cowardly Lion (Fictitious character) -- Juvenile fiction', 'Hens -- Juvenile fiction', 'Voyages and travels -- Juvenile fiction', 'Steamboats -- Juvenile fiction', 'Vacations -- Juvenile fiction', 'Magic -- Juvenile fiction', 'Fantasy literature'}",Text,1909,53,3,10
9562,13164,PG2184,Unbeaten Tracks in Japan,"Bird, Isabella L. (Isabella Lucy)",1831,1904,['en'],145,"{'Bird, Isabella L. (Isabella Lucy), 1831-1904 -- Travel -- Japan', 'Japan -- Description and travel'}",Text,1881,50,3,10
4739,6754,PG1607,A Journey in Other Worlds: A Romance of the Future,"Astor, John Jacob",1864,1912,['en'],145,"{'Space ships -- Fiction', 'Jupiter (Planet) -- Fiction', 'Manned space flight -- Fiction', 'Science fiction', 'Saturn (Planet) -- Fiction', 'Utopias -- Fiction'}",Text,1894,30,1,10
12212,16835,PG25153,Tales of a Wayside Inn,"Longfellow, Henry Wadsworth",1807,1882,['en'],145,{'American poetry'},Text,1863,56,3,8
2821,4182,PG13765,Le mystère de la chambre jaune,"Leroux, Gaston",1868,1927,['fr'],146,"{'Detective and mystery stories', 'Rouletabille, Joseph (Fictitious character) -- Fiction'}",Text,1908,40,2,10
6286,8724,PG17854,The Sport of the Gods,"Dunbar, Paul Laurence",1872,1906,['en'],146,"{'Rural-urban migration -- United States -- Fiction', 'Domestic fiction', 'African American families -- Fiction'}",Text,1902,30,1,10
278,499,PG1044,Extract from Captain Stormfield's Visit to Heaven,"Twain, Mark",1835,1910,['en'],146,"{'Voyages, Imaginary', 'Satire', 'Heaven -- Fiction', 'Religious fiction', 'Ship captains -- Fiction'}",Text,1909,74,4,10
8058,11083,PG19978,35 Sonnets,"Pessoa, Fernando",1888,1935,['en'],146,{'Poetry'},Text,1918,30,1,
5594,7874,PG17089,The Tale of Mrs. Tittlemouse,"Potter, Beatrix",1866,1943,['en'],147,{'Mice -- Juvenile fiction'},Text,1911,45,2,
10518,14520,PG2306,"Uncle Remus, His Songs and His Sayings","Harris, Joel Chandler",1848,1908,['en'],147,"{'African American men -- Literary collections', 'African Americans -- Songs and music', 'Plantation life -- Literary collections', 'African Americans -- Folklore -- Literary collections', 'Animals -- Folklore -- Literary collections', 'Georgia -- Literary collections', 'Remus, Uncle (Fictitious character) -- Literary collections'}",Text,1881,33,1,10
11487,15873,PG24288,Das Stunden-Buch,"Rilke, Rainer Maria",1875,1926,['de'],149,{'German poetry -- 20th century'},Text,1905,30,1,10
4563,6518,PG15868,"The Man Without a Country, and Other Tales","Hale, Edward Everett",1822,1909,['en'],149,"{'Short stories, American', 'Burr Conspiracy, 1805-1807 -- Fiction', 'Exiles -- Fiction', 'Stateless persons -- Fiction', 'Soldiers -- Fiction', 'Sea stories', 'Historical fiction'}",Text,1863,41,2,8
16467,22720,PG3044,Desperate Remedies,"Hardy, Thomas",1840,1928,['en'],151,"{'Young women -- Fiction', 'Love stories', ""Lady's maids -- Fiction"", 'Wessex (England) -- Fiction'}",Text,1871,31,1,9
16727,23060,PG30756,"The Stones of Venice, Volume 3 (of 3)","Ruskin, John",1819,1900,['en'],151,{'Architecture -- Italy -- Venice'},Text,1853,34,1,7
12777,17610,PG25851,"The Life of Charles Dickens, Vol. I-III, Complete","Forster, John",1812,1876,['en'],152,"{'Dickens, Charles, 1812-1870', 'Novelists, English -- 19th century -- Biography'}",Text,1839,27,1,5
5472,7720,PG16950,"Goblin Market, The Prince's Progress, and Other Poems","Rossetti, Christina Georgina",1830,1894,['en'],152,{'English poetry'},Text,1862,32,1,8
7133,9786,PG1880,"The Pathfinder; Or, The Inland Sea","Cooper, James Fenimore",1789,1851,['en'],155,"{'Frontier and pioneer life -- Fiction', 'United States -- History -- French and Indian War, 1754-1763 -- Fiction', 'Love stories', 'Indians of North America -- Fiction', 'War stories', 'Bumppo, Natty (Fictitious character) -- Fiction', 'Ontario, Lake (N.Y. and Ont.) -- Fiction', 'Historical fiction'}",Text,1840,51,3,5
13567,18741,PG2686,The Book of Snobs,"Thackeray, William Makepeace",1811,1863,['en'],157,{'Snobs and snobbishness -- Humor'},Text,1847,36,2,6
8367,11539,PG20387,A Thin Ghost and Others,"James, M. R. (Montague Rhodes)",1862,1936,['en'],158,"{'Horror tales, English', 'Short stories, English', 'Ghost stories, English'}",Text,1919,57,3,
8720,12042,PG2083,"In Search of the Castaways; Or, The Children of Captain Grant","Verne, Jules",1828,1905,['en'],160,"{'Seafaring life -- Fiction', 'South America -- Fiction', 'Castaways -- Fiction', 'Ocean travel -- Fiction', 'Voyages and travels -- Fiction', 'Australia -- Fiction', 'Ship captains -- Fiction', 'New Zealand -- Fiction'}",Text,1876,48,2,9
2525,3765,PG1338,Selected Prose of Oscar Wilde,"Wilde, Oscar",1854,1900,['en'],160,"{'Essays', 'Short stories'}",Text,1890,36,2,10
4821,6886,PG16199,Memoirs of the Author of a Vindication of the Rights of Woman,"Godwin, William",1756,1836,['en'],161,"{'Feminists -- Great Britain -- Biography', 'Authors, English -- 18th century -- Biography', 'Wollstonecraft, Mary, 1759-1797'}",Text,1798,42,2,1
3749,5420,PG1487,The Perfect Wagnerite: A Commentary on the Niblung's Ring,"Shaw, Bernard",1856,1950,['en'],161,"{'Wagner, Richard, 1813-1883. Ring des Nibelungen', 'Opera'}",Text,1898,42,2,10
11547,15953,PG2435,The Crimson Fairy Book,"Lang, Andrew",1844,1912,['en'],162,"{'Folklore', 'Fairy tales'}",Text,1913,69,4,
12330,17009,PG2530,"The Malay Archipelago, Volume 1: The Land of the Orang-utan and the Bird of Paradise; A Narrative of Travel, with Studies of Man and Nature","Wallace, Alfred Russel",1823,1913,['en'],162,"{'Malay Archipelago -- Description and travel', 'Natural history -- Malay Archipelago', 'Ethnology -- Malay Archipelago', 'Wallace, Alfred Russel, 1823-1913 -- Travel -- Malay Archipelago'}",Text,1869,46,2,8
7350,10064,PG1905,"The Governess; Or, The Little Female Academy","Fielding, Sarah",1710,1768,['en'],163,"{'School children -- Fiction', 'Schools -- Fiction', ""Girls' schools -- Fiction"", 'Governesses -- Fiction', 'Didactic fiction'}",Text,1749,39,2,0
7494,10252,PG19229,Anticipations: Of the Reaction of Mechanical and Scientific Progress upon Human life and Thought,"Wells, H. G. (Herbert George)",1866,1946,['en'],163,"{'Social prediction', 'Civilization', 'Twentieth century -- Forecasts', 'Communication and traffic'}",Text,1914,48,2,
3720,5385,PG14848,The Story of Miss Moppet,"Potter, Beatrix",1866,1943,['en'],164,"{'Kittens -- Juvenile fiction', 'Mice -- Juvenile fiction'}",Text,1916,50,3,
20836,28420,PG35580,On the Laws of Japanese Painting: An Introduction to the Study of the Art of Japan,"Bowie, Henry P.",1848,1921,['en'],165,"{'Painting, Japanese'}",Text,1891,43,2,10
4003,5778,PG15200,Selections From the Works of John Ruskin,"Ruskin, John",1819,1900,['en'],166,{'Art'},Text,1884,65,4,10
15583,21559,PG29405,The Gods of Mars,"Burroughs, Edgar Rice",1875,1950,['en'],169,"{'Carter, John (Fictitious character) -- Fiction', 'Science fiction', 'Dejah Thoris (Fictitious character) -- Fiction', 'Life on other planets -- Fiction', 'Mars (Planet) -- Fiction'}",Text,1918,43,2,
2533,3780,PG13402,The Hindu-Yogi Science of Breath,"Atkinson, William Walker",1862,1932,['en'],170,"{'Yoga', 'Respiration -- Religious aspects -- Hinduism'}",Text,1900,38,2,10
9533,13131,PG2181,"The Marble Faun; Or, The Romance of Monte Beni - Volume 1","Hawthorne, Nathaniel",1804,1864,['en'],171,"{'Women art students -- Fiction', 'Murder -- Fiction', 'Rome (Italy) -- Fiction', 'Americans -- Italy -- Fiction', 'Love stories', 'Artists -- Fiction', 'Nobility -- Fiction', 'Psychological fiction'}",Text,1860,56,3,7
15080,20852,PG2876,The Light That Failed,"Kipling, Rudyard",1865,1936,['en'],171,"{'Artists -- Fiction', 'Man-woman relationships -- Fiction', 'Voyages and travels -- Fiction', 'Blindness -- Fiction', 'War correspondents -- Sudan -- Fiction'}",Text,1891,26,1,10
6231,8660,PG17797,Memoir of Jane Austen,"Austen-Leigh, James Edward",1798,1874,['en'],172,"{'Austen, Jane, 1775-1817', 'Novelists, English -- 19th century -- Biography'}",Text,1871,73,4,9
16813,23167,PG30852,"The Tin Woodman of Oz: A Faithful Story of the Astonishing Adventure Undertaken; by the Tin Woodman, assisted by Woot the Wanderer, the; Scarecrow of Oz, and Polychrome, the Rainbow's Daughter","Baum, L. Frank (Lyman Frank)",1856,1919,['en'],172,"{'Scarecrow (Fictitious character from Baum) -- Juvenile fiction', 'Wizards -- Juvenile fiction', 'Soldiers -- Juvenile fiction', 'Oz (Imaginary place) -- Juvenile fiction', 'Tin Woodman (Fictitious character) -- Juvenile fiction', 'Princess Ozma (Fictitious character) -- Juvenile fiction', 'Love -- Juvenile fiction', 'Good and evil -- Juvenile fiction', 'Gale, Dorothy (Fictitious character) -- Juvenile fiction', 'Witches -- Juvenile fiction', 'Boys -- Juvenile fiction', 'Magic -- Juvenile fiction', 'Fantasy literature'}",Text,1918,62,3,
12497,17241,PG25519,Little Wizard Stories of Oz,"Baum, L. Frank (Lyman Frank)",1856,1919,['en'],173,"{""Children's stories, American"", 'Oz (Imaginary place) -- Juvenile fiction', 'Fantasy literature', 'Short stories'}",Text,1914,58,3,
8689,11998,PG207,The Spell of the Yukon and Other Verses,"Service, Robert W. (Robert William)",1874,1958,['en'],173,{'Yukon River Valley (Yukon and Alaska) -- Poetry'},Text,1907,33,1,10
8114,11176,PG2005,Piccadilly Jim,"Wodehouse, P. G. (Pelham Grenville)",1881,1975,['en'],174,"{'Humorous stories', 'Piccadilly (London, England) -- Fiction'}",Text,1916,35,2,
3420,4987,PG1448,Heidi,"Spyri, Johanna",1827,1901,['en'],174,"{'Orphans -- Fiction', 'Grandfathers -- Fiction', 'Mountain life -- Switzerland -- Fiction', 'Switzerland -- History -- 19th century -- Fiction'}",Text,1881,54,3,10
8105,11165,PG2004,Pigs is Pigs,"Butler, Ellis Parker",1869,1937,['en'],175,"{'Humorous stories', 'Short stories'}",Text,1905,36,2,10
510,828,PG10746,Boule de Suif,"Maupassant, Guy de",1850,1893,['fr'],175,"{'Short stories, French'}",Text,1880,30,1,9
1200,1875,PG11689,Are Women People? A Book of Rhymes for Suffrage Times,"Miller, Alice Duer",1874,1942,['en'],176,{'Women -- Suffrage -- Poetry'},Text,1915,41,2,
12676,17475,PG2572,On the Decay of the Art of Lying,"Twain, Mark",1835,1910,['en'],176,"{'American essays -- 19th century', 'Truthfulness and falsehood'}",Text,1882,47,2,10
2656,3942,PG13549,The Art of War,"Jomini, Antoine Henri, baron de",1779,1869,['en'],176,{'Military art and science'},Text,1910,131,4,10
18812,25809,PG3322,East Lynne,"Wood, Henry, Mrs.",1814,1887,['en'],177,"{'Domestic fiction', 'England -- Fiction', 'France -- Fiction', 'Illegitimate children -- Fiction', 'Governesses -- Fiction', 'Psychological fiction', 'Runaway wives -- Fiction', 'Seduction -- Fiction', 'Accident victims -- Fiction'}",Text,1866,52,3,8
18679,25624,PG33063,Plane Geometry,"Wentworth, G. A. (George Albert)",1835,1906,['en'],179,"{'Geometry, Plane'}",Text,1883,48,2,10
1205,1883,PG11696,The Food of the Gods and How It Came to Earth,"Wells, H. G. (Herbert George)",1866,1946,['en'],180,"{'Science fiction', 'Giants -- Fiction', 'Growth factors -- Fiction', 'Agriculture -- Experimentation -- Fiction', 'Food supply -- Fiction'}",Text,1901,35,2,10
22438,30527,PG37478,The Prose Writings of Heinrich Heine,"Heine, Heinrich",1797,1856,['en'],181,"{'Heine, Heinrich, 1797-1856 -- Translations into English'}",Text,1899,102,4,10
1716,2654,PG1238,The City of Dreadful Night,"Thomson, James",1834,1882,['en'],182,{'English poetry'},Text,1880,46,2,9
6937,9541,PG1858,Plain Tales from the Hills,"Kipling, Rudyard",1865,1936,['en'],182,"{'India -- History -- British occupation, 1765-1947 -- Fiction', 'Short stories, English', 'British -- India -- Fiction'}",Text,1882,17,-1,10
2711,4015,PG13614,"Studies in the Psychology of Sex, Volume 5: Erotic Symbolism; The Mechanism of Detumescence; The Psychic State in Pregnancy","Ellis, Havelock",1859,1939,['en'],182,"{'Sex', 'Sex (Psychology)'}",Text,1896,37,2,10
6835,9397,PG1845,"Zuleika Dobson; Or, An Oxford Love Story","Beerbohm, Max, Sir",1872,1956,['en'],182,"{'University of Oxford -- Fiction', 'Oxford (England) -- Fiction', 'Young women -- Fiction', 'Love stories', 'College students -- Fiction', 'College stories'}",Text,1911,39,2,
8377,11553,PG2039,Evangeline: A Tale of Acadie,"Longfellow, Henry Wadsworth",1807,1882,['en'],183,"{'Acadians -- Poetry', 'American poetry'}",Text,1847,40,2,6
3479,5071,PG14565,"Cosmos: A Sketch of the Physical Description of the Universe, Vol. 1","Humboldt, Alexander von",1769,1859,['en'],183,"{'Science -- History', 'Physical geography', 'Cosmography', 'Astronomy'}",Text,1862,93,4,8
433,732,PG1065,The Raven,"Poe, Edgar Allan",1809,1849,['en'],183,"{'Ravens -- Poetry', 'Fantasy poetry, American'}",Text,1845,36,2,6
16153,22298,PG3006,Stalky & Co.,"Kipling, Rudyard",1865,1936,['en'],187,{'Schools -- Fiction'},Text,1899,34,1,10
4953,7062,PG16357,Mary: A Fiction,"Wollstonecraft, Mary",1759,1797,['en'],187,"{'Women -- Fiction', 'Feminist fiction', 'Autobiographical fiction'}",Text,1788,29,1,1
3030,4466,PG1401,Tarzan the Untamed,"Burroughs, Edgar Rice",1875,1950,['en'],188,"{'Fantasy fiction', 'Tarzan (Fictitious character) -- Fiction', 'Adventure stories'}",Text,1920,45,2,
10061,13865,PG22480,The Prussian Officer,"Lawrence, D. H. (David Herbert)",1885,1930,['en'],189,"{'Fiction', 'Short stories'}",Text,1916,31,1,
2268,3427,PG13085,A Diversity of Creatures,"Kipling, Rudyard",1865,1936,['en'],189,"{'English poetry', 'Short stories, English'}",Text,1915,50,3,
3187,4689,PG14220,The Tale of the Flopsy Bunnies,"Potter, Beatrix",1866,1943,['en'],189,"{""Children's stories, English"", 'Rabbits -- Juvenile fiction'}",Text,1904,38,2,10
1153,1810,PG1162,The Jacket (The Star-Rover),"London, Jack",1876,1916,['en'],189,"{'Death row inmates -- Fiction', 'Psychological fiction', 'California State Prison at San Quentin -- Fiction', 'Prisoners -- Fiction', 'Reincarnation -- Fiction', 'San Quentin (Calif.) -- Fiction'}",Text,1915,39,2,
20798,28373,PG35538,The Squatter and the Don: A Novel Descriptive of Contemporary Occurrences in California,"Ruiz de Burton, María Amparo",1832,1895,['en'],191,"{'Mexicans -- California -- Fiction', 'Domestic fiction', 'California -- Fiction', 'Love stories', 'Ethnic relations -- Fiction', 'Squatters -- Fiction', 'Conflict of generations -- Fiction', 'Landowners -- Fiction', 'Land tenure -- Fiction'}",Text,1878,46,2,9
4169,5998,PG1539,The Winter's Tale,"Shakespeare, William",1564,1616,['en'],192,"{'Tragicomedy', 'Sicily (Italy) -- Kings and rulers -- Drama', 'Fathers and daughters -- Drama', 'Castaways -- Drama', 'Married people -- Drama'}",Text,1756,192,4,1
14619,20219,PG2819,Barrack Room Ballads,"Kipling, Rudyard",1865,1936,['en'],192,{'Soldiers -- Poetry'},Text,1903,38,2,10
16906,23289,PG30962,An Apology for the Life of Mrs. Shamela Andrews,"Fielding, Henry",1707,1754,['en'],193,"{'Richardson, Samuel, 1689-1761 -- Parodies, imitations, etc.', 'Richardson, Samuel, 1689-1761. Pamela'}",Text,1740,33,1,0
5307,7532,PG16780,The Declaration of Independence of The United States of America,"Jefferson, Thomas",1743,1826,['en'],193,"{'United States -- History -- Revolution, 1775-1783 -- Sources', 'United States. Declaration of Independence'}",Text,1863,120,4,8
16254,22443,PG301,The Ballad of Reading Gaol,"Wilde, Oscar",1854,1900,['en'],194,"{'Prisons -- Poetry', 'Imprisonment -- Poetry', 'Prisoners -- Poetry'}",Text,1899,45,2,10
23098,31440,PG3829,Love Among the Chickens,"Wodehouse, P. G. (Pelham Grenville)",1881,1975,['en'],196,"{'Chicken breeders -- Fiction', 'Ukridge, Stanley Featherstonehaugh (Fictitious character) -- Fiction', 'England -- Fiction', 'Farm life -- Fiction', 'Humorous stories'}",Text,1918,37,2,
16674,22997,PG3069,The Great Boer War,"Doyle, Arthur Conan",1859,1930,['en'],198,"{'South African War, 1899-1902'}",Text,1902,43,2,10
21644,29472,PG36528,Monsieur Vénus,Rachilde,1860,1953,['fr'],201,"{'Sex role -- Fiction', 'French fiction', 'Man-woman relationships -- Fiction', 'Social classes -- Fiction'}",Text,1868,8,-1,8
5580,7857,PG17073,La Regenta,"Alas, Leopoldo",1852,1901,['es'],203,"{'Spain -- Social life and customs -- Fiction', 'Married people -- Spain -- Fiction'}",Text,1885,33,1,10
3739,5407,PG14868,The Tailor of Gloucester,"Potter, Beatrix",1866,1943,['en'],204,"{'Christmas -- Juvenile fiction', 'Mice -- Juvenile fiction'}",Text,1903,37,2,10
561,895,PG10806,The Sword of Welleran and Other Stories,"Dunsany, Lord",1878,1957,['en'],205,"{'Fantasy fiction, English'}",Text,1917,39,2,
17100,23546,PG31193,Manifesto of the Communist Party,"Engels, Friedrich",1820,1895,['en'],206,"{'Socialism', 'Communism'}",Text,1848,28,1,6
12423,17135,PG25423,狂人日記,"Lu, Xun",1881,1936,['zh'],209,"{'Diaries -- Fiction', 'Chinese fiction -- 20th century'}",Text,1918,37,2,
14996,20726,PG28656,Typee,"Melville, Herman",1819,1891,['en'],209,"{'Sailors -- Fiction', 'Marquesas Islands (French Polynesia) -- Fiction', 'Adventure stories', 'Indigenous peoples -- Fiction'}",Text,1842,23,0,6
10163,13998,PG225,At the Back of the North Wind,"MacDonald, George",1824,1905,['en'],209,{'Fairy tales'},Text,1871,47,2,9
8730,12053,PG2084,The Way of All Flesh,"Butler, Samuel",1835,1902,['en'],212,"{'Bildungsromans', 'Parent and adult child -- Fiction', 'England -- Fiction', 'Domestic fiction', 'Young men -- Fiction', 'Children of clergy -- Fiction', 'Conflict of generations -- Fiction', 'Middle class -- Fiction', 'Autobiographical fiction'}",Text,1903,68,4,10
9300,12840,PG21558,The Children of the New Forest,"Marryat, Frederick",1792,1848,['en'],212,"{'Great Britain -- History -- Civil War, 1642-1649 -- Juvenile fiction', 'Foresters -- Juvenile fiction', 'Soldiers -- Juvenile fiction', 'Orphans -- Juvenile fiction', 'New Forest (England : Forest) -- Juvenile fiction'}",Text,1847,55,3,6
4866,6950,PG16256,"The Psychology of Management: The Function of the Mind in Determining, Teaching and Installing Methods of Least Waste","Gilbreth, Lillian Moller",1878,1972,['en'],213,"{'Industrial efficiency', 'Industrial management', 'Psychology, Industrial'}",Text,1914,36,2,
1402,2255,PG1202,Tales of Unrest,"Conrad, Joseph",1857,1924,['en'],215,"{'Adventure stories, English', 'Short stories'}",Text,1898,41,2,10
